{
  "$schema": "../../../schemas/library-work.schema.json",
  "version": "1.0.0",
  "generatedAt": "2026-09-03",
  "id": "osa",
  "title": {
    "en": "Official Secrets Act, 1923",
    "hi": "शासकीय गुप्त बात अधिनियम, 1923"
  },
  "shortTitle": {
    "en": "OSA 1923",
    "hi": "ओएसए 1923"
  },
  "year": 1923,
  "category": "security",
  "description": {
    "en": "The Official Secrets Act — prohibited places, wrongful communication of information, and the offences an officer handling classified material is expected to know by heart.",
    "hi": "शासकीय गुप्त बात अधिनियम — प्रतिषिद्ध स्थान, सूचना का दोषपूर्ण संसूचन, तथा वर्गीकृत सामग्री संभालने वाले अधिकारी से अपेक्षित अपराधों की जानकारी।"
  },
  "corpus": {
    "kind": "rules",
    "file": "rules/text/osa.json"
  },
  "unitLabel": {
    "en": "Section",
    "hi": "धारा"
  },
  "publisher": "Ministry of Home Affairs",
  "tocSource": "flat",
  "toc": [
    {
      "id": "n-osa-1",
      "number": "1",
      "heading": {
        "en": "Short title, extent and application",
        "hi": "संक्षिप्त नाम, विस्तार और लागू होना"
      },
      "unitIds": [
        "osa-1"
      ]
    },
    {
      "id": "n-osa-2",
      "number": "2",
      "heading": {
        "en": "Definitions",
        "hi": "परिभाषाएँ"
      },
      "unitIds": [
        "osa-2"
      ]
    },
    {
      "id": "n-osa-3",
      "number": "3",
      "heading": {
        "en": "Penalties for spying",
        "hi": "जासूसी के लिए शास्तियाँ"
      },
      "unitIds": [
        "osa-3"
      ]
    },
    {
      "id": "n-osa-4",
      "number": "4",
      "heading": {
        "en": "Communications with foreign agents to be evidence of commission of certain offences",
        "hi": "विदेशी अभिकर्ताओं से संसूचना का कुछ अपराधों के किए जाने का साक्ष्य होना"
      },
      "unitIds": [
        "osa-4"
      ]
    },
    {
      "id": "n-osa-5",
      "number": "5",
      "heading": {
        "en": "Wrongful communication. etc., of information",
        "hi": "सूचना का दोषपूर्ण संसूचन आदि"
      },
      "unitIds": [
        "osa-5"
      ]
    },
    {
      "id": "n-osa-6",
      "number": "6",
      "heading": {
        "en": "Unauthorised use of uniforms; falsification of reports, forgery, personation, and false",
        "hi": "वर्दियों का अप्राधिकृत प्रयोग; रिपोर्टों का मिथ्याकरण, कूटरचना, प्रतिरूपण और मिथ्या दस्तावेज"
      },
      "unitIds": [
        "osa-6"
      ]
    },
    {
      "id": "n-osa-7",
      "number": "7",
      "heading": {
        "en": "Interfering with officers of the police or members of the Armed forces of the Union",
        "hi": "पुलिस अधिकारियों या संघ के सशस्त्र बलों के सदस्यों के कार्य में बाधा डालना"
      },
      "unitIds": [
        "osa-7"
      ]
    },
    {
      "id": "n-osa-8",
      "number": "8",
      "heading": {
        "en": "Duty of giving information as to commission of offences",
        "hi": "अपराधों के किए जाने के बारे में जानकारी देने का कर्तव्य"
      },
      "unitIds": [
        "osa-8"
      ]
    },
    {
      "id": "n-osa-9",
      "number": "9",
      "heading": {
        "en": "Attempts, incitements, etc",
        "hi": "प्रयत्न, दुष्प्रेरण आदि"
      },
      "unitIds": [
        "osa-9"
      ]
    },
    {
      "id": "n-osa-10",
      "number": "10",
      "heading": {
        "en": "Penalty for harbouring spies",
        "hi": "जासूसों को संश्रय देने के लिए शास्ति"
      },
      "unitIds": [
        "osa-10"
      ]
    },
    {
      "id": "n-osa-11",
      "number": "11",
      "heading": {
        "en": "Search warrants",
        "hi": "तलाशी वारंट"
      },
      "unitIds": [
        "osa-11"
      ]
    },
    {
      "id": "n-osa-13",
      "number": "13",
      "heading": {
        "en": "Restriction on trial of offences",
        "hi": "अपराधों के विचारण पर निर्बंधन"
      },
      "unitIds": [
        "osa-13"
      ]
    },
    {
      "id": "n-osa-14",
      "number": "14",
      "heading": {
        "en": "Exclusion of public from proceedings",
        "hi": "कार्यवाहियों से जनता का अपवर्जन"
      },
      "unitIds": [
        "osa-14"
      ]
    },
    {
      "id": "n-osa-16",
      "number": "16",
      "heading": {
        "en": "[Repeals.] Rep. by the Repealing Act, 1927 (12 of 1927), s. 2 and Sch",
        "hi": "निरसन"
      },
      "unitIds": [
        "osa-16"
      ]
    }
  ],
  "readingOrder": [
    "osa-1",
    "osa-2",
    "osa-3",
    "osa-4",
    "osa-5",
    "osa-6",
    "osa-7",
    "osa-8",
    "osa-9",
    "osa-10",
    "osa-11",
    "osa-13",
    "osa-14",
    "osa-16"
  ],
  "estimatedMinutes": 50,
  "practiseCounts": {
    "osa-1": 2,
    "osa-10": 3,
    "osa-11": 5,
    "osa-13": 4,
    "osa-14": 3,
    "osa-16": 1,
    "osa-2": 3,
    "osa-3": 6,
    "osa-4": 3,
    "osa-5": 6,
    "osa-6": 4,
    "osa-7": 4,
    "osa-8": 3,
    "osa-9": 2
  },
  "examTags": [
    "security",
    "vigilance"
  ],
  "amendments": {},
  "officialUrl": "https://www.mha.gov.in/sites/default/files/Official_Secret_Act1923_2.pdf",
  "source": {
    "name": "Ministry of Home Affairs — The Official Secrets Act, 1923",
    "url": "https://www.mha.gov.in/sites/default/files/Official_Secret_Act1923_2.pdf"
  },
  "disclaimer": {
    "en": "Reference only; verify with the official gazette/order or your DDO.",
    "hi": "केवल संदर्भ के लिए; आधिकारिक राजपत्र/आदेश अथवा अपने डीडीओ से सत्यापित करें।"
  },
  "verify": true
}
